{
  "schema": "skilltape.dev/permissions/v1",
  "filesystem": {
    "read": [
      "inputs/change.diff",
      "outputs/review/change.diff"
    ],
    "write": [
      "outputs/review/change.diff"
    ]
  },
  "process": {
    "executables": [],
    "max_processes": 1,
    "default_timeout_ms": 1000
  },
  "network": {
    "enabled": false,
    "allow_hosts": []
  },
  "secrets": {
    "read_environment": false
  }
}
